{
  "message_id": "00000000-0000-4000-8000-000000000041",
  "message_kind": "event",
  "message_type": "job.cancelled",
  "message_version": 1,
  "occurred_at": "2026-09-07T10:00:04Z",
  "correlation_id": "00000000-0000-4000-8000-000000000002",
  "causation_id": "00000000-0000-4000-8000-000000000001",
  "producer": "data",
  "subject": { "kind": "job", "id": "00000000-0000-4000-8000-000000000003" },
  "payload": { "job_id": "00000000-0000-4000-8000-000000000003", "reason": "user_requested", "cancelled_at": "2026-09-07T10:00:04Z" }
}
